{
  "schema": "schemas/invariants.schema.json",
  "format": "tier1_invariants",
  "contract_id": "UMA.INTSTACK.v1",
  "closure_registry_id": "UMCP.CLOSURES.DEFAULT.v1",
  "canon": {
    "pre_doi": "10.5281/zenodo.17756705",
    "post_doi": "10.5281/zenodo.18072852",
    "weld_id": "W-2025-12-31-PHYS-COHERENCE",
    "timezone": "America/Chicago"
  },
  "rows": [
    {
      "t": 0,
      "omega": 0.08333333333333337,
      "F": 0.9166666666666666,
      "S": 0.26650585761810336,
      "C": 0.10624918300339495,
      "tau_R": "INF_REC",
      "kappa": -0.08870108191811514,
      "IC": 0.9151190783342483,
      "regime": {
        "label": "Watch",
        "critical_overlay": false
      }
    },
    {
      "t": 1,
      "omega": 0.06000000000000005,
      "F": 0.94,
      "S": 0.22299907139251463,
      "C": 0.043204937989385774,
      "tau_R": "INF_REC",
      "kappa": -0.062141989459682384,
      "IC": 0.9397494428018729,
      "regime": {
        "label": "Watch",
        "critical_overlay": false
      }
    },
    {
      "t": 2,
      "omega": 0.053333333333333344,
      "F": 0.9466666666666667,
      "S": 0.2051162125340208,
      "C": 0.03399346342395183,
      "tau_R": "INF_REC",
      "kappa": -0.05496843467921045,
      "IC": 0.9465150245323309,
      "regime": {
        "label": "Watch",
        "critical_overlay": false
      }
    },
    {
      "t": 3,
      "omega": 0.03333333333333344,
      "F": 0.9666666666666666,
      "S": 0.12560289308504252,
      "C": 0.06798692684790389,
      "tau_R": "INF_REC",
      "kappa": -0.034528108752190194,
      "IC": 0.9660611845304081,
      "regime": {
        "label": "Stable",
        "critical_overlay": false
      }
    },
    {
      "t": 4,
      "omega": 0.06666666666666676,
      "F": 0.9333333333333332,
      "S": 0.23765824266623728,
      "C": 0.06182412330330465,
      "tau_R": "INF_REC",
      "kappa": -0.06954970172125241,
      "IC": 0.932813769782424,
      "regime": {
        "label": "Watch",
        "critical_overlay": false
      }
    },
    {
      "t": 5,
      "omega": 0.06333333333333335,
      "F": 0.9366666666666666,
      "S": 0.22893088802393974,
      "C": 0.05734883511361748,
      "tau_R": "INF_REC",
      "kappa": -0.06589837562020742,
      "IC": 0.9362260028442235,
      "regime": {
        "label": "Watch",
        "critical_overlay": false
      }
    },
    {
      "t": 6,
      "omega": 0.07000000000000006,
      "F": 0.9299999999999999,
      "S": 0.23953435049137745,
      "C": 0.08164965809277258,
      "tau_R": "INF_REC",
      "kappa": -0.07353559055407982,
      "IC": 0.9291030779097306,
      "regime": {
        "label": "Watch",
        "critical_overlay": false
      }
    },
    {
      "t": 7,
      "omega": 0.056666666666666754,
      "F": 0.9433333333333332,
      "S": 0.21507625428287777,
      "C": 0.03399346342395193,
      "tau_R": "INF_REC",
      "kappa": -0.05849896594895229,
      "IC": 0.9431792156946185,
      "regime": {
        "label": "Watch",
        "critical_overlay": false
      }
    }
  ],
  "notes": "Generated by UMCP-REF-E2E-0001 pipeline"
}
